小説『由煕』で第100回芥川賞を受賞した作家は？,イヤンジ
小説家の大江匡とお雪の恋愛を描いた永井荷風の小説は？,ぼくとうきたん
少年愛をテーマにした作品を多く残しました,いながきたるほ
少年時代の思い出を描いた中勘助の自伝的小説は？,ぎんのさじ
消費税を導入したときの総理大臣のフルネームは？,たけしたのぼる
信仰のために命を捧げること,じゅんきょう
政治小説『経国美談』を書いた明治の作家は？,やのりゅうけい
仙人になろうとする青年を主人公とした芥川龍之介の小説です,とししゅん
代表作に『黄瀬川陣』『王昭君』『鴻門会』などがある日本画家,やすだゆきひこ
代表作に『鳴門』『醍醐』などがある日本の画家です,おくむらとぎゅう
代表作に『老猿』『西郷隆盛像』がある明治の彫刻家は？,たかむらこううん
谷崎潤一郎の小説『細雪』の主人公は○○家の四人姉妹？,まきおか
調印された条約を締結権を持つ機関が承認すること,ひじゅん
鳥類の肺に数対ついている薄い膜の袋,きのう
日本で活躍するカナダ出身の作家Ｃ・Ｗ・ニコルの小説です,いさな
日本ペンクラブ会長も務めた作家です,おざきほつき
日本人初のノーベル文学賞受賞者,かわばたやすなり
日露戦争下の金沢を舞台にした五木寛之の小説です,ときのはか
念写の発見者といわれる日本の超心理学者,ふくらいともきち
白話文学を提唱した中国の思想家,こてき
貧しい農民の生活を描いた小説『土』で有名な作家は？,ながつかたかし
魔女狩り事件を扱った平野啓一郎の芥川賞受賞作は？,にっしょく
明治の作家・森鴎外の小説『ヰタ・セクスアリス』の主人公,かねいしずか
明治時代に樋口一葉が学んだ歌人・中島歌子の歌塾は？,はぎのや
明治時代の作家・樋口一葉の師匠であり恋人であった作家,なからいとうすい
幽霊のお露が登場する三遊亭圓朝の怪談は？,ぼたんどうろう
2004年１月に公開された横山秀夫原作の映画,はんおち
2004年には映画『珈琲時光』に主演して女優デビューしました,ひととよう
2004年に開催された○○○花博？,はまなこ
2004年に魚住昭が著した話題の本は『○○○○差別と権力』？,のなかひろむ
2004年に自伝『ゲバゲバ70年』を出版しました,おおはしきょせん
2004年に出版差し止めの処分を受けた雑誌は「週刊○○」？,ぶんしゅん
2004年フィギュアスケートの世界選手権で優勝しました,あらかわしずか
2005年１月に誕生した栃木県の市は○○○○市？,なすしおばら
2005年３月22日に秋田県に誕生した新しい都市は○○市,かたがみ
2005年５月にＴＢＳの男子アナ安東弘樹との結婚を発表しました,かわはたゆうか
2005年５月に更迭された東京都副知事です,はまうずたけお
2005年７月に鹿児島県に誕生した新しい都市は○○市？,そお
2005年９月２日に茨城県に誕生する都市は○○市？,なめがた
2005年に『国家の罠』を出版した別名「外務省のラスプーチン」,さとうまさる
2005年にモーニング娘。の第７期メンバーとして新加入,くすみこはる
2005年に起きた日中問題の解決に尽力しました,まちむらのぶたか
2005年に死去した薬害エイズ事件の被告だった元帝京大学副学長,あべたけし
2005年に先進国首脳会議サミットを開催する国は？,イギリス
2005年に野球殿堂入りしたＮＨＫのアナウンサーは？,しむらまさより
2005年のベストセラー小説『終わりからの旅』の作者,つじいたかし
2005年公開の映画『逆境ナイン』に主演した俳優です,たまやまてつじ
『ダーリンの頭ン中』の作者は小栗○○○？,さおり
『冬のソナタ』のヒロインを演じた韓国の女優,チェジウ
『恋のバカンス』でデビューした加護亜依、辻希美のユニット,ダブルユー
ＣＤ『強いキズナ』で芸能界に復帰,すずきあみ
ＳＡＲＳ騒動で有名になりました,ハクビシン
この歴史上の人物を描いた2005年公開の映画は？,アレキサンダー
コカ・コーラ社から新しく発売された緑茶ドリンク,はじめ
デジタル絵本『ストレイシープ』でメリー役を演じています,ゆさみもり
デビュー以来快進撃を続ける期待の若手ボクサーです,かめだこうき
ライブドアとフジテレビの争いで注目を集めました,むらかみよしあき
海老沢勝二会長が辞任した後ＮＨＫの新会長に就任しました,はしもとげんいち
現在の日本経団連の会長は？,おくだひろし
参議院で当選した経済財政・郵政民営化担当大臣,たけなかへいぞう
史上最年少で芥川賞を受賞した綿矢りさが通う大学は？,わせだ
首相補佐官に任命された前外務大臣,かわぐちよりこ
小説『親鸞』『蓮如』で有名な2005年に亡くなった作家です,にわふみお
正式には「端島」という廃墟ブームで有名になった島,ぐんかんじま
全日本女子バレーのエース「プリンセス・メグ」といえば？,くりはらめぐみ
日本アカデミー賞作品賞を受賞した映画『半落ち』の監督は？,ささべきよし
野田義治がプロデュースした女性８人組ユニットです,みやび
「ちょっかいを出す」という言葉はこの動物の動作が由来です,ねこ
「びっくりする、ぎょっとする」という意味の言葉,たまげる
「出家」に対し、僧侶が世俗の人間に戻ること,げんぞく
「人が集まり、親しみあう月」という意味がある、１月の別名,むつき
「人は○○のみにて生きるものにあらず」？,パン
「息も絶え絶え」という意味,きそくえんえん
『古今和歌集』の歌風のたとえにされる、か弱い女性を指す言葉,たおやめ
あらゆる仕事を一人でたくみに処理する能力を持っていること,はちめんろっぴ
いったん支出したお金をもとの予算に戻し入れることです,れいにゅう
けちな人のこと,りんしょくか
これは着てても、心は錦です,ぼろ
へたな囲碁のことを、ある台所用品を使って何という？,ざるご
もともとは鳥の寝る巣を意味した人が寝に帰る住みかのこと,ねぐら
ものごとをおろそかにしたりいい加減にして放っておくこと,なおざり
キョロキョロすること,とみこうみ
チベット語で「神の地」という意味の中国チベット自治区の都市,ラサ
チョークを日本語でいうと？,はくぼく
メガネやバッグにもその名前がつくものがあります,ボストン
安楽に、悠々と暮らすさまを「左○○」という？,うちわ
一つの道で最も尊敬されている人のこと,たいざんほくと
陰謀や悪事の常に行われている所,ふくまでん
英語では「ドルフィン」という海に住む哺乳類,いるか
英語では「ファウンテンペン」,まんねんひつ
宴会などが真っ盛りに行われている状態のこと,たけなわ
家を借りる人です,たなこ
歌舞伎の場面が語源,どろじあい
楽器のウクレレはハワイの言葉で「跳ねる○○」という意味です,ノミ
漢字で書くと「薬を煎じるもの」という意味になります,やかん
見るまでは死ねません,ナポリ
若く未熟な人をあざけってこれが「黄色い」と表現します,くちばし
手紙を書いても返事がありません,なしのつぶて
真面目で堅苦しいことを、ある漢数字を使った言葉で何という？,しかくしめん
人の話に合わせてうなづくこと,あいづち
相手に首を切られても後悔しないほど強い友情は「何の交わり」？,ふんけい
俗に「武士は食わねど○○○」といいます,たかようじ
他人の文章や学説などを盗作し自分のものとして発表すること,ひょうせつ
男性の中に、女性が１人だけいる様子を表す言葉といえば？,こういってん
同じ事をしても人によって力量に違いがあることを喩えた言葉です,あいごせいもく
物を売っているお坊さん,まいす
歩幅のたとえにも使われます,コンパス
料理の味付けに使われるものにちなむ、料理の味加減のこと,あんばい
10円カレーが有名な日比谷公園にあるレストラン,まつもとろう
11月15日です,しちごさん
1958年、東京の池袋で創業した定食屋チェーン,おおとや
90歳のお祝いです,そつじゅ
「うどんすき」を登録商標とした店,みみう
「銀座のユダヤ人」と呼ばれた日本マクドナルドの創業者,ふじたでん
「幻の鮭」と呼ばれます,けいじ
「七変化」という別名もあります,あじさい
「南無妙法蓮華経・・」,だいもく
「明日はヒノキになろう」という意味です,あすなろ
お正月の飾りに使われるミカン科の果物,だいだい
きりたんぽによく合います,ひないどり
こんがり焼けたパンの色は何色？,きつね
ざるそばにありもりそばにないもの,のり
もともとは庶民の平服だった鎌倉時代以降の武家の礼服,ひたたれ
アンクレットをつける場所,あしくび
ウマ科、サイ科、バク科に分けられます,きているい
エースコックのマークでブタが右手に持っているものは？,フライパン
オーストラリアだけに棲息しています,カモノハシ
クリスチャン・ディオールの香水「プアゾン」の意味,どく
スケトウダラの卵巣,めんたいこ
スペインの国花といえば？,カーネーション
スペイン語で「鎧を着たもの」という意味の名前をもつ動物は？,アルマジロ
タイワンドジョウとカムルチーのこと,らいぎょ
ツルッと食べます,ところてん
トッグルというボタンが特徴,ダッフルコート
ホウキ、ブラシ、縄などの原料になるヤシ科の植物,しゅろ
レールと枕木を固定します,いぬくぎ
運動会の競技で割られるもの,くすだま
英語では「ペーパーウェイト」,ぶんちん
貝殻が退化した巻貝の一種です,なめくじ
掛け軸の下につけるおもり,ふうちん
漢字で「海虎」と書きます,アメフラシ
間接的に温める方法,ゆせん
魚ではないのに魚へんです,くじら
恐竜もこれの一種でした,はちゅうるい
渓流のほとりに生える日本原産の植物,わさび
最高級品とされる冬に採れる椎茸,どんこ
埼玉県蕨市が発祥の地とされています,せいじんしき
持ち込みを禁止しているホテルもあります,ドリアン
時計の針を動かします,りゅうず
七味唐辛子にも入っているミカンの皮を乾燥させたもの,ちんぴ
釈迦の棺の材料になった植物,ビャクダン
寿司ネタでもおなじみのウバガイの別名,ほっきがい
樹木の形を整えるために枝の一部を切り取ること,せんてい
秋の味覚です,さんま
十二支と星占いの星座に共通する動物です,ひつじ
神を祭る神聖な場所に張ります,しめなわ
神奈川県の木です,イチョウ
進物の上にかけたり物を包んだりします,ふくさ
青森県に棲むといわれる妖怪,かわうそ
昔は冬の必需品でした,ゆたんぽ
茶碗蒸しなどを加熱しすぎると入るもの,す
朝鮮出兵のときに加藤清正が持ち帰りました,セロリ
鉄人・陳健一の父が日本に広めました,まーぼどうふ
天然記念物の白蛇はこれの一種です,アオダイショウ
冬には蜜柑がよく似合います,こたつ
日本の本州から九州にかけて生息するキツツキ科の鳥,あおげら
日本生まれなのに中国の地名がついた料理,てんしんはん
納豆を包むときなどに使います,わらづと
馬のひづめは人間のこれにあたります,なかゆび
背中の縞模様が特徴のイノシシの子供です,うりぼう
白い表皮が木綿を巻いたように見えることから名がついた植物,はまゆう
発明のきっかけはナポレオンがかけた懸賞金,かんづめ
氷に穴を開けて釣ります,ワカサギ
物を研ぐのに使ったことからその名がついたシダ植物,とくさ
毛色は白、黒、茶色です,みけねこ
雷が鳴るまで離れません,スッポン
和裁に使います,くじらじゃく
和室にある建具です,びょうぶ
1957年、江戸川乱歩賞を『猫は知っていた』で受賞,にきえつこ
1962年、北海道の農民が自衛隊の通信線を切断して起きた事件,えにわじけん
2004年４月から民営化されました,なりたくうこう
2005年４月１日に兵庫県に誕生した新しい都市は○○市？,しそう
2005年に死去したジャケットブランド「ＶＡＮ」の設立者,いしづけんすけ
「つん」という犬を連れています,さいごうさん
「とっとり梨の花温泉郷」の一つ,はわいおんせん
「とっとり梨の花温泉郷」の一つ,みささおんせん
「マニフェスト」はふつうこう訳されます,せいけんこうやく
「南無阿弥陀仏・・」,ねんぶつ
「肉を斬らせて骨を断つ」といわれた剣術の流派,じげんりゅう
この屋根の形式を何という？,よせむね
イギリスの銀行家オリバー・フランクスが最初に用いた言葉,なんぼくもんだい
カゲロウの羽のように薄くて丈夫といわれる土佐名産の和紙,てんぐじょうし
ソニーの前身である東京通信工業を設立した一人,いぶかまさる
パソコンのデスクトップの背景に表示された写真や図柄,かべがみ
ベストセラー『ノストラダムスの大予言』の著者は？,ごとうべん
ミステリー作家・京極夏彦の作品,てっそのおり
ユダヤ教の象徴となっているエルサレムの名所,なげきのかべ
安寿と厨子王を買った伝説上の長者,さんしょうだゆう
奥州三名湯のひとつです,あきうおんせん
岡山市に本店を置く百貨店,てんまや
歌舞伎の定式幕にも使われる色,もえぎいろ
河童の大好物です,しりこだま
芥川賞と直木賞の選考会が行われる東京都・築地の料亭,しんきらく
吉田茂の孫にあたる現在の総務大臣,あそうたろう
宮部みゆきの代表作,かしゃ
旧日本海軍が用いた人間魚雷,かいてん
京都三大祭のひとつです,あおいまつり
軍隊に付属する食料・武器・弾薬など軍需品の総称,しちょう
建物が完成したことを祝って行われる儀式,しゅんこうしき
現在の迎賓館である旧赤坂離宮を設計した建築家,かたやまとうくま
国税のひとつです,ぞうよぜい
裁判官を裁くために国会に設けられるのは○○裁判所？,だんがい
集中豪雨で起こる災害のひとつ,どせきりゅう
小豆島の景勝地「寒霞渓」の名付け親である儒学者,ふじさわなんがく
新一万円札と十円玉に共通して描かれている鳥,ほうおう
真珠の重さの単位です,もんめ
神宮、皇居などの外側にある広い庭園のこと,がいえん
正月の縁起物として神社で売られます,はまや
西村真琴が作った東洋初のロボットの名前,がくてんそく
戦前は吉本興業が所有していました,つうてんかく
贈り物に添えられる色紙を折ったもの,のし
太平洋戦争終戦１ヶ月後の日本を襲ったのは○○台風,まくらざき
第１回は太田朋子が受賞した女性科学者に贈られる賞,さるはししょう
茶道で使う茶入の一種,なつめ
東京の隅田川にかかっています,かちどきばし
難読名字のひとつです,たかなし
日本の鉄道駅を五十音順に並べると最初にくるのは○○駅？,あいおい
日本三大霊場のひとつです,ひえいざん
日本神話に登場する英雄です,スサノオノミコト
日本人で初めて新婚旅行をしました,さかもとりょうま
副題を『キッチン２』というよしもとばななの小説,まんげつ
福井県鯖江市が生産量日本一です,メガネ
有名な温泉地です,いかほ
1990年放映の刑事ドラマ,でかきぞく
1995年放映の清水美砂主演のドラマは『○○においでよ』？,うち
1998年にテレビ朝日に入社した女子アナウンサー,のむらまさき
1999年に安達祐実が主演したＴＶドラマは『青い鳥○○○』？,シンドローム
1999年に入社したテレビ朝日の女子アナウンサーです,りゅうえんあいり
2000年のドラマ『あっとほーむ』に主演した日本舞踊家・女優です,おのえゆかり
2003年に骨髄バンクのＣＭに映像が使われた今は亡き女優,なつめまさこ
2004年にボーダフォンのＣＭに出演しました,なりみやひろき
2005年に放映されたフジテレビのお昼のドラマ,ふゆのりんぶ
「ひょうきん懺悔室』では神父を務めたプロデューサー,よこざわたけし
『ＮＨＫニュース７』に出演している女性気象予報士です,なからいさえ
『こたえてちょーだい！』で司会を務めるフジテレビの女子アナ,きくまゆきの
『ひとつ屋根の下』『高校教師』などの作品がある脚本家は？,のじましんじ
『ガッコの先生』や『ショムニ』などのＴＶドラマに出演した女優,さくらいあつこ
『火曜サスペンス劇場』の監察医・室生亜希子役で有名,はまゆうこ
ＳＭＡＰの香取慎吾が主演した1996年のＴＶドラマは？,とうめいにんげん
ＴＶドラマ『ぽっかぽか』で女の子のあすかを演じました,かみわきゆう
ＴＶドラマ『パーフェクトラブ』『ラブコンプレックス』に出演,きむらよしの
ＴＶドラマ『ヤヌスの鏡』で主人公を演じたアイドルは？,すぎうらみゆき
ＴＶドラマ『刑事★イチロー』『ぼくの魔法使い』などに出演,ぬくみずよういち
ＴＶドラマ『古畑任三郎』や『オヤジぃ。』の主演俳優は？,たむらまさかず
ＴＶドラマ『必殺仕置屋稼業』で怪力の僧侶・印玄を演じました,あたらしかつとし
ＴＶドラマ『僕だけのマドンナ』『ちゅらさん』を担当した脚本家,おかだよしかず
ＴＶ番組『報道ステーション』でコメンテーターを務めています,かとうちひろ
ＴＶ番組『料理の鉄人』ではマントを着て司会を務めました,かがたけし
お昼のＴＶドラマ『はるちゃん』シリーズの主演女優です,なかはらかなん
かつてシュワルツェネッガーがＣＭで両手に持って踊りました,やかん
ドラマ『ちゅらさん』で主人公の夫・文也の母を演じた女優です,まやきょうこ
ドラマ『サインはＶ』でジュン・サンダースを熱演,はんぶんじゃく
ドラマ『ショムニ,ファイナル』『白い巨塔』などに出演した俳優
ドラマ『ヤンキー母校に帰る』や『ああ探偵事務所』に出演しました,ながいまさる
ドラマ『俺たちの旅』などに出演した俳優・秋野太作の昔の芸名,つさかまさあき
ドラマ『俺たちの旅』の洋子役,かなざわみどり
ドラマ『傷だらけのラブソング』で高橋克典と共演した歌手は？,なかしまみか
ドラマ『直子センセの診察日記』の主演や２時間ドラマでおなじみ,おおたからともこ
伊藤かずえ主演の大映ドラマです,ちきょうだい
奥州藤原氏四代の戦いを描いた1993年放映開始の大河ドラマ,ほむらたつ
加藤紀子が姑にいじめられる嫁を演じた1998年のＴＶドラマ,らせつのいえ
及川光博主演のＴＶドラマは『ミステリー民俗学者○○○』？,やくもいつき
現役のラクロスの選手でもあるテレビ朝日のアナウンサー,かわのあきこ
最近は『トリビアの泉』でおなじみのＳＦ・オカルト作家,あらまたひろし
司会を務めた『紅白歌合戦』で「次はミソラ・・・」と発言,うぶかたけいいち
石田ひかり主演のドラマです,わる
長年にわたってテレビ朝日夜10時の顔でした,くめひろし
藤竜也が主演した1987年放映のドラマは『ベイシティ○○』？,コップ
毎日放送が制作する深夜番組は『痛快！明石家○○○』？,テレビ
1961年の小津安二郎監督の映画は『○○○○の秋』？,こはやがわけ
1962年に田宮二郎が主演した映画は『黒の○○○』？,テストカー
1967年の映画『007は二度死ぬ』でボンドガールを演じた女優,わかばやしあきこ
1976年公開の大島渚監督の映画『愛のコリーダ』の主人公です,あべさだ
1981年の映画『悪霊島』で舞台となる島は○○島？,おさかべ
1986年の映画『キネマの天地』でヒロインの田中小春を演じました,ありもりなりみ
1990年の映画『天と地と』で津川雅彦が演じた戦国武将は？,たけだしんげん
1998年のアカデミー賞短編ドキュメンタリー賞を受賞,いびけいこ
1999年公開の映画『黒い家』に主演した俳優は？,うちのまさあき
2000年に公開された映画『仮面学園』の主演俳優,ふじわらたつや
2004年に公開されたキム・ジウン監督による韓国のホラー映画,たんす
2005年の映画『ローレライ』でヒロインを演じた女優,かしいゆう
『Ｓｈａｌｌ　ｗｅ　ダンス？』で有名な日本の映画監督,すおうまさゆき
『リリイ・シュシュのすべて』や『花とアリス』で有名な映画監督,いわいしゅんじ
『稀人』や『呪怨』などのホラー映画で知られる監督は？,しみずたかし
『鬼畜大宴会』『空の穴』などの作品がある映画監督は？,くまきりかずよし
『湖の琴』『陽のあたる坂道』『乳母車』で有名な映画監督です,たさかともたか
『午後の遺言状』『原爆の子』などの作品がある映画監督です,しんどうかねと
『豪姫』『利休』などの作品がある映画監督は○○○○宏？,てしがはら
『世界の中心で、愛をさけぶ』や『北の零年』で有名な映画監督,ゆきさだいさお
『南極物語』『キタキツネ物語』などの作品がある映画監督です,くらはらこれよし
『非行少女』『男の紋章』など日活の青春映画で活躍しました,いずみまさこ
『隣の八重ちゃん』などの映画に主演した戦前の女優,あいぞめゆめこ
ＳＭＡＰの中居正広が主演した宮部みゆき原作の映画は？,もほうはん
ここが舞台になった映画です,ぽっぽや
これを飲むほど強くなるジャッキー・チェンの出世作,すいけん
カンヌで最優秀男優賞を受賞,やぎらゆうや
カンヌ映画祭の国際批評家週間に入選した青島幸男監督の映画は？,かね
カンヌ国際映画祭グランプリを受賞した今村昌平監督の映画,ならやまぶしこう
コロンバイン高校の銃乱射事件を題材にした2003年の映画です,エレファント
シャロン・ストーン主演による1993年のサスペンス映画,がらすのとう
スタンリー･キューブリック監督の代表作は『時計じかけの？』,オレンジ
スピルバーグ監督の映画『未知との遭遇』の舞台,デビルスタワー
ダリオ・アルジェント監督のデビュー映画は『歓びの○○』？,きば
マーティン・スコセッシ監督ニコラス・ケイジ主演の映画,きゅうめいし
メル・ギブソン演じる主人公が誘拐犯と戦う1997年の映画,みのしろきん
リチャード・ギアが出演した黒澤映画は『八月の○○○』？,ラプソディー
渥美清や豊川悦司が主演した金田一耕助が登場する映画,やつはかむら
伊丹十三の監督デビュー作は？,おそうしき
映画『めし』『浮雲』などで有名な映画監督は成瀬○○○？,みきお
映画『ウォーターボーイズ』や『ひみつの花園』の監督は？,やぐちしのぶ
映画『シベリア超特急』に出演した通称「ボンちゃん」,にしだかずあき
映画『ツィゴイネルワイゼン』『陽炎座』で有名な監督です,すずきせいじゅん
映画『ドレミファ娘の血は騒ぐ』に出演した女優です,どうぐちよりこ
映画『ニッポン無責任時代』で植木等が演じたお調子者の主人公,たいらひとし
