将棋で歩がなると？,と
将棋で銀が移動できるマスは何マス?,５
のび太の誕生日は何月何日でしょう？,８月７日
将棋で金が移動できるマスは何マス?,６
GitHubのマスコットキャラクター,オクトキャット
四国地方は、香川、愛媛、高知、あとひとつは?,とくしま
ドラミちゃんが好きな食べ物,メロンパン
ガチャピンは◯◯のこども,きょうりゅう
ムックは◯◯のこども,ゆきおとこ
タラちゃんの苗字,ふぐた
のび太の先生の名前は何でしょう？,えいいちろう
水上でボードに乗って、ボートで引っ張るスポーツは？「◯◯ボード」,ウェイク
長崎県の離島・壱岐で発祥した焼酎は「◯焼酎」,むぎ
山手線の恵比寿駅と五反田駅の間は◯◯駅,めぐろ
山手線の目黒駅と大崎駅の間は◯◯駅,ごたんだ
山手線の五反田駅と品川駅の間は◯◯駅,おおさき
山手線の大崎駅と田町駅の間は◯◯駅,しながわ
山手線の品川駅と浜松町駅の間は◯◯駅,たまち
山手線の田町駅と新橋駅の間は◯◯駅,はままつちょう
山手線の浜松町駅と有楽町駅の間は◯◯駅,しんばし
山手線の新橋駅と東京駅の間は◯◯駅,ゆうらくちょう
山手線の有楽町駅と神田駅の間は◯◯駅,とうきょう
山手線の東京駅と秋葉原駅の間は◯◯駅,かんだ
山手線の神田駅と御徒町駅の間は◯◯駅,あきはばら
山手線の秋葉原駅と上野駅の間は◯◯駅,おかちまち
山手線の御徒町駅と鶯谷駅の間は◯◯駅,うえの
山手線の上野駅と日暮里駅の間は◯◯駅,うぐいすだに
山手線の鶯谷駅と西日暮里駅の間は◯◯駅,にっぽり
山手線の日暮里駅と田端駅の間は◯◯駅,にしにっぽり
山手線の西日暮里駅と駒込駅の間は◯◯駅,たばた
山手線の田端駅と巣鴨駅の間は◯◯駅,こまごめ
山手線の駒込駅と大塚駅の間は◯◯駅,すがも
山手線の巣鴨駅と池袋駅の間は◯◯駅,おおつか
山手線の大塚駅と目白駅の間は◯◯駅,いけぶくろ
山手線の池袋駅と高田馬場駅の間は◯◯駅,めじろ
山手線の目白駅と新大久保駅の間は◯◯駅,たかだのばば
山手線の高田馬場駅と新宿駅の間は◯◯駅,しんおおくぼ
山手線の新大久保駅と代々木駅の間は◯◯駅,しんじゅく
山手線の新宿駅と原宿駅の間は◯◯駅,よよぎ
山手線の代々木駅と渋谷駅の間は◯◯駅,はらじゅく
山手線の原宿駅と恵比寿駅の間は◯◯駅,しぶや
山手線の渋谷駅と目黒駅の間は◯◯駅,えびす
カナダの首都は？,オタワ
カナダの主にケベックで話されるフランス語のことをなんというか,ケベコワ
赤毛のアンの舞台となる島の名前は？プリンスエドワードアイランド
MFの前田がバイクマンガで1番に思いつく漫画といえば？,ぶっこみのたく
特攻の拓の読み方,ぶっこみのたく
8/15に長崎である行事は◯◯流し,しょうろう
柿を食べると鐘がなるのは◯◯寺,ほうりゅう
Eminem主演の映画は,えいとまいる
「 ＼(^o^)／ 」の読み方は？,おわた
ダン・オブ・？？,さーずでい
フィラデルフィアは○○州,ペンシルバニア
「伊豆の瞳」とも呼ばれる静岡県伊東市にある湖,いっぺきこ
「蝦夷富士」という別名があります,ようていざん
「磁石の指す北」と「真北」の間の角度のこと,へんかく
「天然痘をはらう」という意味の京都府久御山町の地名,いもあらい
「嵐の岬」と呼ばれていたことも,きぼうほう
『奥の細道』にも登場する秋田県の景勝地,きさかた
『竹取物語』にも登場します,ふじさん
６つの大字が集まってできた群馬県の村,くに
いろいろ書き込んで使います,はくちず
かつてはニシン漁で栄えた北海道浜益村の集落,ごきびる
かつては後醍醐天皇も滞在した奈良県南部の梅の名所,あのう
かつては石見銀山の積出港として栄えた島根県の町,ゆのつ
かつては相模国の国府があった小田原市の町,こうづ
その噴火によって尾瀬沼ができた福島県の南西部にある火山,ひうちがたけ
イチゴの生産量日本一です,とちぎけん
カスピ海や死海のような塩分を多く含んだ湖,かんすいこ
カメルーンの国名はポルトガル語でこの生物の意味,エビ
サンドスキー場や龍宮窟で知られる静岡県下田市の集落,とうじ
メノウ細工で知られる福井県小浜市の集落,おにゅう
ヤマタノオロチの伝説で知られる宍道湖に注ぐ川,ひいがわ
愛知県豊田市の改名される前の名前,ころも
井戸の水が酒になったという伝説から名がついた千葉県の町,しすい
英語では「グリーンハウス・エフェクト」といいます,おんしつこうか
遠洋漁業の基地となっている宮城県北東部の都市,けせんぬま
塩の産地として知られる沖縄県の島,あぐにじま
岡山県と鳥取県の境にある火山群,ひるぜん
沖縄県宮古島の北部に大潮の時だけ姿を現す珊瑚礁,やびじ
温室を使わずに野菜や花を栽培すること,ろじさいばい
下流には輪中がみられる濃尾平野を流れる川,いびがわ
海女の里として知られる三重県鳥羽市の漁村,いじか
鬼が退治されて平和になったといわれる長野市の山村,きなさ
宮崎県にある城下町です,おび
近年急速に発展した中国の中小企業の形態です,ごうちんきぎょう
九州にある霧島火山群の最高峰,からくにだけ
九州自然動物公園がある大分県宇佐市の町,あじむ
狐の嫁入り道中で知られる稲荷神社がある四日市市の地区,みやまど
港や川の水深を増すため水底の土砂や岩石をさらうこと,しゅんせつ
埼玉県にもっとも多い建物,しやくしょ
山の方から吹きます,おろし
山形県米沢市を中心とする最上川上流の地方,おきたま
滋賀県の面積の約６分の１,びわこ
鹿児島県の菱刈などで採掘されています,きん
小笠原諸島の聟島と嫁島の間にある島,なこうどじま
小麦は５月頃、米は９月頃,はざかいき
松花江の南岸に位置する中国黒竜江省の都市,ハルビン
焼き物で有名な栃木県南東部の町,ましこ
織田信長が命名したといわれています,ぎふ
新潟、富山、石川、福井４県の総称,ほくりく
人口は30万人以上です,ちゅうかくし
世界で７番目に大きい島です,ほんしゅう
世界遺産です,しらかみさんち
世界遺産の城跡がある沖縄県国頭郡の村,なきじん
世界有数の大都市です,ニューヨーク
星が降ったという言い伝えから命名された山口県の都市,くだまつ
青森県の花は？,リンゴ
静岡県の三保の松原はこれの一種,さし
赤道もこれの一種,いせん
大宰府の役人が住んだことから命名された福岡県大野城市の地区,ざっしょのくま
大昔の植物が変化したものです,せきたん
大都市の周辺にある中小都市,えいせいとし
大陸性気候では大きく海洋性気候では小さい,にちかくさ
地名を書いた紙を鼠にかじられ漢字が変わった滋賀県の集落,やないだ
中国・チベット自治区の中心都市,ラサ
中国の特別行政区,ほんこん
長い歴史を持つアフリカの共和国,エジプト
長野県の諏訪湖などで冬に見られる現象,おみわたり
田中康夫知事が住民登録して話題となった長野県の村,やすおか
渡良瀬川のものが有名な洪水や水害を防ぐための池,ゆうすいち
冬の樹氷が有名な山形県と宮城県にまたがる火山群,ざおう
東京都港区芝公園内にある徳川家の菩提寺,ぞうじょうじ
東京都西部の檜原村にある集落,へんぼり
東北地方で唯一の政令指定都市,せんだい
東北地方によく見られる民家の形です,まがりや
踏むと音がする鳴り砂で有名は宮城県気仙沼市の海岸,くぐなりはま
特産品の碁石で知られる宮崎県北部の都市,ひゅうが
南はバベルマンデブ海峡　北はスエズ運河,こうかい
日本でもっとも面積の小さい埼玉県の市,わらび
日本で最も南にある県庁所在地,なは
日本と韓国が領有権を主張しています,たけしま
日本の民家の屋根の形です,いりもや
日本は12海里まで,りょうかい
日本最大の不凍湖,しこつこ
日本三弁天の一つがある琵琶湖北部の島,ちくぶしま
日本有数の多雨地域として知られる三重県の市,おわせ
波のように曲がった地層の構造,しゅうきょく
肥後藩主細川綱利が開いた公園がある熊本市の地区,はけのみや
法隆寺や中宮寺がある奈良県北部の町,いかるが
北の小京都と呼ばれる北海道唯一の藩が置かれていた町,まつまえ
北緯23度27分です,きたかいきせん
北海道の後志支庁がある羊蹄山北西の町,くっちゃん
北半球では北東　南半球では南東から吹きます,ぼうえきふう
北流して日本海に注ぐ北海道で２番目に長い川,てしおがわ
摩周湖や屈斜路湖がある北海道の町,てしかが
面積の半分以上が米軍基地である沖縄本島にある町,ちゃたん
木曾川・長良川・揖斐川の下流のものが有名です,わじゅう
由利徹のギャグで有名になった北海道の内浦湾に面する町,おしゃまんべ
利根川上空にできる入道雲を俗にこう呼びます,ばんどうたろう
1600年にオランダ船・リーフデ号が漂着しました,うすきわん
1844年、清がアメリカと結んだ不平等条約は○○条約？,ぼうか
1844年、清がフランスと結んだ不平等条約は○○条約？,こうほ
1879年に『民権自由論』を著しました,うえきえもり
1894年に撤廃されました,ちがいほうけん
1928年、奉天に引き上げる途中日本軍によって暗殺されました,ちょうさくりん
1955年に保守合同が実現したときの自由党の総裁,おがたたけとら
607年に随に渡りました,おののいもこ
608年に隋に渡った僧,みん
664年に対馬・壱岐などに防人とともに設置された狼煙の一種,とぶひ
969年に左大臣・源高明が左遷された事件は○○の変？,あんな
「蕉門十哲」に数えられる江戸時代の俳人です,かがみしこう
「定信」の字を分解して題名をつけた松平定信の自叙伝,うげのひとこと
「伝教大師」と呼ばれました,さいちょう
「隋」に代わって中国を統一,とう
『論語』を伝えたとされる渡来人,わに
２人の皇后が唐の政治を混乱させた事件,ぶいのか
４歳で将軍に就き８歳で死去した江戸幕府の第七代将軍,とくがわいえつぐ
この像のあるお寺は？,とうだいじ
イギリスと清の間に起こった戦争の原因ともなった麻薬,アヘン
イギリスの元首相チャーチルの演説で有名「？のカーテン」,てつ
シルクロードを日本語でいうと「“何”の道」？,きぬ
セオドア・ルーズベルト大統領のラテンアメリカに対する政策,こんぼうがいこう
ソ連の歴史上ただ１人の大統領です,ゴルバチョフ
ドイツ帝国宰相・ビスマルクのカトリック弾圧政策,ぶんかとうそう
ハート形、みみずく型などがあります,どぐう
伊勢の豪商・沼波弄山が始めた三重県名産の陶器,ばんこやき
伊庭想太郎に刺殺された明治の政治家,ほしとおる
鎌倉時代、京都に設置された番所,かがりや
鎌倉幕府の最後の将軍,もりくにしんのう
寛政の三博士の一人です,しばのりつざん
寛政の三博士の一人です,びとうじしゅう
漢の武帝が朝鮮に設置しました,げんとぐん
丸橋忠弥とともに慶安の変を起こしました,ゆいしょうせつ
機長はポール・ディベッツＪｒ．,エノラゲイ
義和団事件の講和条約である北京議定書の別名,しんちゅうわやく
警察予備隊→○○○→自衛隊,ほあんたい
現存するわが国最古の歴史書,こじき
故国である楚を憂い詩人・屈原が身を投げた湖,べきら
五街道とその付属街道以外の道路をこう呼びました,わきかいどう
後醍醐天皇の冥福を祈るために天竜寺を開山しました,むそうそせき
後唐、後晋、遼、後漢、後周で高位についた「五代の宰相」,ふうどう
江戸、天明の狂歌三大家とは唐衣橘洲、太田南畝と誰？,あけらかんこう
江戸時代の医師・華岡青洲が乳癌手術に用いた麻酔薬,つうせんさん
江戸初期に対馬と朝鮮が結んだ通商条約,きゆうやくじょう
高橋泥舟、山岡鉄舟とともに「幕末三舟」と呼ばれました,かつかいしゅう
高野長英や渡辺華山が弾圧されました,ばんしゃのごく
坂本龍馬が最期を遂げた京都の醤油屋,おうみや
薩長同盟の立役者です,さかもとりょうま
氏姓制度の「姓」のひとつ,あたい
就任時の年齢が最も若い内閣総理大臣です,いとうひろぶみ
初代特許庁長官も務めました,たかはしこれきよ
勝海舟が艦長を務めました,かんりんまる
臣・連・君・直などがあった古代の豪族の称号,かばね
星座の名前にもなっているルネサンスの三大発明のひとつ,らしんばん
西郷隆盛、板垣退助、江藤新平らが主張しました,せいかんろん
戦国時代の基本的な陣形のひとつ,かくよく
戦国時代の基本的な陣形のひとつ,こうやく
足利義政が建立したのは○○寺？,ぎんかく
代表作に法隆寺金堂の釈迦三尊像がある飛鳥時代の仏像彫刻師は？,くらつくりのとり
大化の改新で廃止された朝廷の直轄地,とんそう
大化の改新後に６歳以上の男女に配られました,くぶんでん
大正デモクラシーの指導者・吉野作造が唱えました,みんぽんしゅぎ
大日本帝国憲法や教育勅語などの起草に参加した明治の官僚,いのうえこわし
第二次世界大戦前のスローガン,きょこくいっち
地質年代で、第４紀前半の氷河時代にあたります,こうしんせい
中国・五胡十六国時代の「五胡」のひとつ,きょう
中国で起こった「安史の乱」の「史」とはこの人のこと,ししめい
中国の易姓革命における君主の交代方法のひとつ,ぜんじょう
中国四大奇書のひとつとされる西門慶を主人公とした小説は？,きんぺいばい
中世まで、銅や鉛などを使って盛んに行われました,れんきんじゅつ
中世日本の同業者組合,ざ
朝鮮戦争の別名にもなっている楽器です,アコーディオン
通称「笑左衛門」と呼ばれた薩摩藩の家老,ずしょひろさと
鶴岡八幡宮で源実朝を暗殺,くぎょう
天保の改革で水野忠邦が解散させました,かぶなかま
渡辺華山による肖像画でも有名な古河藩の蘭学者,たかみせんせき
徳のある者が天命を受けて皇帝になること,えきせいかくめい
徳川家康が派遣しました,しゅいんせん
縄文時代の人々が食べた貝殻や動物の骨を捨てた場所,かいづか
日英同盟の成立に尽力した明治時代の外交官,はやしただす
日本の国際連盟脱退が決まった会議の主席全権,まつおかようすけ
日明貿易では、これと区別するために勘合符が使われました,わこう
武士が武芸訓練として励みました,かさがけ
武士が武芸訓練として励みました,やぶさめ
北米、南米、オーストラリアといえば？,しんたいりく
本名を「ジュガシヴィリ」という旧ソ連の指導者,スターリン
本名を中田実という明治時代の国民主義者,くがかつなん
明治初期、警察官はこう呼ばれました,らそつ
唯一の滋賀県出身の総理大臣です,うのそうすけ
律令時代、北陸道を防御するため設置された関所,あらちのせき
律令制における基本法を補足した追加の法律のこと,きゃく
律令制の役人・国司はここで政務をとりました,こくが
「黒いダイヤ」と呼ばれました,せきたん
６尺を「１」とする長さの単位,けん
Ｎ極とＳ極があります,じしゃく
ｘ軸とｙ軸で分けられる部分,しょうげん
おおいぬ座のアルファ星シリウスの中国での呼び名,てんろうせい
おしべのこと。音読みすると？,ゆうずい
この元素が体内に不足すると味覚障害の恐れがあります,あえん
てこの原理に必要です,さようてん
てこの原理に必要です,りきてん
アスコルビン酸の欠乏で引き起こされる病気,かいけつびょう
アリとアリマキ、ヤドカリとイソギンチャクなど,きょうせい
ウニの成長過程のひとつ,のうはい
ウミユリ、ヒトデ、ナマコなどがこの仲間です,きょくひどうぶつ
ギリシャ文字のパイで表します,えんしゅうりつ
ギリシャ文字のパイで表します,しんとうあつ
クスノキから採れる柔らかい結晶,しょうのう
ケフェウス型変光星やミラ型長周期変光星など,みゃくどうせい
シーラカンスはこの仲間,そうきるい
ビタミンＡの欠乏で起こります,やもうしょう
プラスとマイナスがあります,ドライバー
マッチや火薬の原料として利用される元素,いおう
マツやイチョウなど風を利用して受粉する花,ふうばいか
胃の粘膜に無数に並ぶ微細な穴,いしょうか
英語では「フードチェーン」,しょくもつれんさ
液体の流動性と固体の光学的性質をあわせもつ物質の状態,えきしょう
円周上の一点が描く軌跡です,サイクロイド
火山や温泉で見られる鉱物です,いおう
極めて低温のとき液体ヘリウムに見られる粘性０の状態,ちょうりゅうどう
空気を遮断して、木材や石炭などを加熱します,かんりゅう
原子番号10の元素です,ネオン
固体が液体を経ずに気体に変化します,しょうか
固体に力を加えて変形させ力を抜いても元に戻らない性質,そせい
恒星がその一生を終えるときに引き起こす大規模な爆発現象,ちょうしんせい
骨の中がすきまだらけになる病気といえば○○○症？,こつそしょう
砂丘の表面にできる美しい模様です,ふうもん
最初はホウレンソウの葉から発見されたビタミン,ようさん
三角関数で用いる、半径１で中心が原点にある円のこと,たんいえん
質量の単位のひとつです,キログラム
種子の中にあり、発芽のための養分を貯蔵しています,はいにゅう
常温で液体である元素,しゅうそ
真珠の重さを表す単位,もんめ
人間の心臓には２つあります,しんぼう
水晶はこの鉱物の結晶です,せきえい
水素と酸素の化合物です,みず
世界初のものはオランダの学者レーウェンフックが製作しました,けんびきょう
正しくは「積乱雲」,にゅうどうぐも
俗に「魚の目」と呼ばれます,けいがん
太陽に最も近い惑星,すいせい
太陽の表面にある周りより温度の低い部分,こくてん
体長は１～３mm,ミジンコ
台風や低気圧によって海水面が上昇する現象,たかしお
単位は「アンペア」,でんりゅう
地下茎の周りの葉が肉厚で球状の塊になっているもの,りんけい
地下水のくみ上げすぎなどが原因で起こります,じばんちんか
地震の揺れのうち、はじめに現れる小さな揺れ,しょきびどう
虫歯になることを意味する医学用語,うしょく
天球上の太陽の通り道,おうどう
導電性ポリマーの発見と開発でノーベル化学賞を受賞,しらかわひでき
銅に生じる緑色のサビ,ろくしょう
日本からは全く見えない南天の星座の１つです,ふうちょう
日本語では「極光」という自然現象は？,オーロラ
妊娠する能力を表す医学用語,にんようせい
飛行機の主翼に上向きにかかる力,ようりょく
必ず同じ角度になります,たいちょうかく
氷が溶けて水になります,ゆうてん
表皮の角質層からはがれ落ちます,ふけ
風をひくと出る「せき」のことです,がいそう
分母・分子が分数になっています,はんぶんすう
幕末から明治にかけて「化学」はこう呼ばれました,せいみ
理科の実験道具です,しけんかん
連鎖球菌が原因で起こり赤い発疹をともなう疾患,しょうこうねつ
19世紀フランスの作家モーパッサンのデビュー作は？,しぼうのかたまり
「フィロソフィー」という英語を「哲学」と訳した日本の哲学者,にしあまね
「辛酉」の年は革命がおこるなど未来の吉凶についての説,しんいせつ
『どてらい男』『銭の花』などの小説を書いた昭和の作家は？,はなとこばこ
『タクシー狂躁曲』『血と骨』などの小説で知られる作家は？,ヤンソギル
『ローマ人の物語』シリーズで有名なイタリア在住の女流作家,しおのななみ
『鞍馬天狗』『パリ燃ゆ』などの小説を書いた作家,おさらぎじろう
『芸能界「一発屋」外伝』などの著書がある芸能評論家,ほうせんかおる
『古寺巡礼』『風土』などの著書で有名な日本の哲学者は？,わつじてつろう
『十六夜日記』を著した女流歌人,あぶつに
『巴里からの遺言』『愛の領分』などの作品で知られる作家は？,ふじたよしなが
エコール・ド・パリを代表する日本人画家,ふじたつぐはる
オスカー・ドミンゲスが始めたこのような絵画の技法の名称は？,デカルコマニー
オランダの画家ゴッホが好んで題材にした花です,ひまわり
チベットに潜入し『西蔵旅行記』を書いた日本の仏教学者,かわぐちえかい
パソコンの周辺機器のひとつです,マウス
レベッカ・シャープを主人公としたサッカレーの小説は？,きょえいのいち
安楽死をテーマとした森鴎外の小説です,たかせぶね
伊勢湾口に浮かぶ神島を舞台にした三島由紀夫の小説,しおさい
何も考えずひたすら座禅する曹洞宗の修行法,しかんたざ
歌集『海やまのあひだ』で有名な別名を「釈超空」という歌人は？,おりくちしのぶ
歌人・斎藤茂吉を父にもつ芥川賞作家です,きたもりお
海軍軍人・川島武男と片岡浪子の恋愛を描いた徳富蘆花の小説は？,ほととぎす
芥川龍之介の遺作となった小説の題名は？,はぐるま
柿本人麻呂、山部赤人と共に「和歌三神」といわれる人物は？,そとおりひめ
牛鍋を食べる庶民の姿を描いた仮名垣魯文の代表作は？,あぐらなべ
句集『冬青空』『雑草園』などで知られる岩手県出身の俳人は？,やまぐちせいそん
剣豪・机竜之介を主人公とする中里介山の小説は？,だいぼさつとうげ
国木田独歩の代表作は『牛肉と○○○』？,じゃがいも
作家・火野葦平の芥川賞受賞作です,ふんにょうたん
作家・三島由紀夫の義理の父にあたる画家です,すぎやまやすし
作家・島崎藤村の小説『破戒』の主人公は？,せがわうしまつ
作家の浅田次郎のおじに当たる第５代中央気象台長,ふじわらさくへい
桜井みかげを主人公としたよしもとばななの小説は？,キッチン
山本周五郎の小説『赤ひげ診療譚』の主人公,にいできょじょう
紫式部の『源氏物語』第二巻の名前です,ははきぎ
詩集『一握の玻璃』『砂金』などで知られる詩人,さいじょうやそ
蒔岡家の四姉妹を描いた谷崎潤一郎の小説は？,ささめゆき
主人公・早瀬主税と元芸者・お蔦の恋を描いた泉鏡花の小説は？,おんなけいず
主人公の僧侶・宗朝の不思議な体験を描いた泉鏡花の小説です,こうやひじり
初めて足のない幽霊を描いたと言われる江戸時代の画家,まるやまおうきょ
書道や絵画の作品が完成した後に作者が署名や押印をすること,らっかん
女優アルカージナが登場するチェーホフの小説は？,かもめ
女流作家・平岩弓枝の直木賞受賞作です,たがねし
小説『ウホッホ探検隊』で有名な作家は○○あがた？,ひかり
小説『金閣寺』で知られる作家三島由紀夫の命日を何という？,ゆうこくき
